,Name,Street_Address,State,City,Zip_Code,Type,Reviews,No_of_Reviews,Comments,Price_Range
620,Justin's Ristorante,234 Lafayette Ave,NJ,Hawthorne,07506-1940," Italian, Vegetarian Friendly, Gluten Free Options",4.5,128,"Great place to celebrate an occasion or just to go to dinner with your significant other. 
The food is cooked fresh and comes out steaming hot.",Medium
621,Aki,1273 Broad St,NJ,Bloomfield,07003-3029," Japanese, Sushi, Asian",4.5,70,"Very large portions of all items, including sushi......all very good and reasonably priced....in a comfortable setting.",Medium
622,John Brown Smokehouse,1043 44th Dr,NY,Long Island City,11101-7037," American, Bar, Barbecue",4.5,396,"Headed here late on my first night staying locally for a quick bite to eat. Got here just after 9pm and unsurprisingly, they’d sold out of pulled pork and burnt ends (my first two choices), but I was more than happy to sample the brisket...More",Medium
623,Taste of Europe,1901 W Pioneer Pkwy,TX,Arlington,76013-6108," Polish, Russian, Eastern European",4.5,226,The European food was tasty and plentiful.  It’s an acquired taste.  Three couples had dinner.  I had potato pancakes (3) stuffed with ground beef and served with a small portion of sour cream. Surprisingly it was ample. Two others had vegan potato pancakes stuffed mushrooms....More,Medium
624,Indochine Asian Dining Lounge,1924 Pacific Ave,WA,Tacoma,98402-3110," Asian, Thai, Vegetarian Friendly",4.0,418,Excellent food and service. Lovely atmosphere. Will definitely revisit in the future. All the entrees were great,Medium
625,Royal Orchid Thai Cuisine,104 Rainier Ave S,WA,Renton,98057-2044," Asian, Thai, Vegetarian Friendly",4.0,50,"I had gone there with my fiancee (and, my former fiancee!) to meet for a lunch. The food was excellent! It was not too busy, which made it all the better. The wait staff was very courteous and professional. I had been there years ago,...More",Medium
626,Tokyo-ya Ramen & Izakaya,31507 Pacific Hwy S,WA,Federal Way,98003-5405," Japanese, Asian, Soups",4.5,28,"This is the adult version of Ichiban and it is delicious. On a cold rainy day in Seattle there's nothing better. I had their most popular Ramen, with loads of noodles in a miso broth. It comes with pork belly, seaweed, bamboo shoot, a hard...More",Medium
627,Quaker Steak & Lube,1036 Cedar Bridge Ave,NJ,Brick,08723-4000," American, Bar",3.5,128,We love going to Quaker State Lube mainly for the wings and a great selection of beers. We always get the bucket of wings and have plenty to take home for whenever.,Medium
628,B Side Pizzeria,370 W 51st St,NY,New York City,10019-6403," Italian, Pizza, Vegetarian Friendly",4.5,490,"We loved our visit. The Killer Bee Pizza is great and so is Marge. We also enjoyed the eggplant Parmesan. If anything could be better it would be the seating arrangement. In any case, we will certainly be back.",Medium
629,Bonnell's Restaurant,4259 Bryant Irvin Rd,TX,Fort Worth,76109-4223," American, Southwestern, Gluten Free Options",4.5,312,"Attended a business dinner here and had a private room. Started with mini tacos and chips with dip displayed nicely. These were yummy, and a nice start to evening. Had a lemon caesar salad that was basic, and not very lemony, but fresh anyway. Then...More",Expensive
630,Ithaca Beer Co.,122 Ithaca Beer Dr,NY,Ithaca,14850-8813," American, Brew Pub, Bar",4.5,308,We celebrated Valentine's Day at the Taproom. Thoroughly enjoyable. We hadn't been there in a dozen years so it was like catching up with an old friend. They have their own farm now. They post on the blackboard how much of their food is currently...More,Medium
631,Olio e Piu,3 Greenwich Ave,NY,New York City,10014-3543," Italian, Pizza, Tuscan",4.5,2534,"Love this place!!!
The food is amazing, and the atmosphere is so warm! Can’t wait to come back. Ilir you’re the best. Thanks for a delightful evening!",Medium
632,Flo Restaurant & Bar,1150 106th Ave NE,WA,Bellevue,98004-4313," Japanese, Sushi, Asian",4.5,119,"I usually try to visit this time of year for omakaze dinner special.  This time I visited for lunch.  Excellent omakaze sashimi platter!  Maguro, tako, hotate, Atlantic and sockeye salmon/sake, hamachi, and 2 specials of the day, including shima aji.  Excellent!  Special taste of ikura...More",Medium
633,Ali Baba Mediterranean Grill,2103 N Central Expy,TX,Richardson,75080-2708," Mediterranean, Middle Eastern, Vegetarian Friendly",4.5,219,"There is lots of jealousy there ,the women I dated didn't like it there ,the food is horrible,many faker Muslim Egyptian acts there,I hate devoted patriotic acts of Terror to the middle East",Medium
634,Feast,1024 S Alamo St,TX,San Antonio,78210-1176," American, Contemporary, Vegetarian Friendly",4.5,432,We went there for dinner - not sure what to expect.  our waiter was wearing a Star Wars t-shirt and backwards cap.  asked for 3 ozs of jack Daniel and he returned with they were out but offered me a selections of scotchs.  final settle...More,Medium
635,Hester's Cafe,1902 N Shoreline Blvd,TX,Corpus Christi,78401-1138," Cafe, American, Vegetarian Friendly",4.5,102,"The service, food and coffee was just amazing!  If I could order and have things shipped then I would order weekly!  I loved it!  Fresh and delicious!",Medium
636,Texas,3609 Shire Blvd,TX,Richardson,75082-2245," American, Steakhouse, Gluten Free Options",4.5,306,"This is a good place, something for everyone. The menu is extremely varied, both selections and prices. The number of service people is almost over-the-top. Prices vary from $12.95 for a nice burger plate to about $50 for a large filet. Several fish dishes also,...More",Expensive
637,Micklethwait Craft Meats,1309 Rosewood Ave,TX,Austin,78702-2024," American, Southwestern, Barbecue",4.5,233,"After getting in line for Franklin Barbecue at 9 am, waiting a while and then hearing that we might be in line for 5 hours but not get to eat because of where we were we decided that no barbecue could be worth that wait....More",Medium
638,Velo Eatery,1616 Route 9,NJ,Toms River,08755-1206," Seafood, American, Soups",4.5,117,"Velo is a great little find. Creative, inventive, and simply delicious food!!
Seafood at it's  finest! 
A little hard to find only open a few days ( fri and sat) in winter..no reservations. They are open  a few more days in summer. see facebook for...More",Medium
639,La Villa Pizza & Family Restaurant,21 S Pennsylvania Avenue,PA,Morrisville,19067," Italian, Pizza, Vegetarian Friendly",4.5,139,"Tomato pie is above average for the Morrisville area.  Quality inconsistent considering the price (over $23), the first tomato pie ordered was fantastic. On a visit two weeks later the identical tomato pie was ordered.  It was disappointing, skimpy toppings and the crust was lightly...More",Medium
640,Black Diamond Oyster Bar,418 Nas Dr,TX,Corpus Christi,78418-3252," American, Bar, Seafood",4.5,188,This was the second time we visited this restaurant.  Well worth the visit.  Enjoyed the oysters and soup!,Medium
641,Wink Restaurant,1014 N Lamar Blvd Ste E,TX,Austin,78703-4964," American, Wine Bar, Vegetarian Friendly",4.5,332,We had an all around great experience for my special sister's special birthday. The birthday girl was presented with delicious desserts and an autographed menu. A Lambrusco paired with chocolate dessert really tickled my taste buds Alfredo provided great service and I was able to...More,Expensive
642,Double Ai,107 Terhune Dr,NJ,Wayne,07470-7103," Sushi, Asian, Chinese",4.0,88,"Nice setting along the riverside. Have always enjoyed any of the sushi dishes I've had here. Food is always fresh and tasty. I like that there are a lot of other non-sushi items on the menu, so if you take someone not into sushi they...More",Medium
643,Texas Roadhouse,2805 W Interstate 40,TX,Amarillo,79109-1606," American, Steakhouse",4.0,306,We have been here before and couldn't wait to come back!   Stopped again on our way home from a ski trip and so glad we did!  It was a very busy Friday night and they told us the wait would be 30-35 minutes but we...More,Medium
644,O'Neills Staten Island,1614 Forest Ave,NY,Staten Island,10302-2230," Irish, American, Vegetarian Friendly",4.5,45,"We attended tonight because our Knights of Columbus was having a fund-raiser. We had pretzels and macraroni and cheese egg roll for apppetizers. My wife had the stuffed pork chops, I had Chicken parmigiana with rigatoni pasta. Our daughter had a burger on an english...More",Medium
645,Mediterranean Breeze,2302 Harrison Ave NW,WA,Olympia,98502-4543," Mediterranean, Turkish, Greek",4.5,146,"After the recent fire, we wondered if the food would still be the same. It is. There was no evidence of a fire. The large wood-fired oven has been replaced by tables and chairs. The menu looked to be about the same with the exception...More",Medium
646,Vila Verde Restaurant,120 Terhune Dr,NJ,Wayne,07470-7104," Seafood, Spanish, Portuguese",4.5,142,"We used to go the Iron Bound section of Newark for Spanish/Portuguese cuisine.  We frequented the restaurant Spain for man years, after almost 50 years of preparing delicious Spanish/Portuguese cuisine, they sadly closed.

Since their closure it's been difficult to find an establishment that cooked...More",Medium
647,Sparks Firehouse Deli,621 5th St SW,WA,Puyallup,98371-5822," American, Bar, Pizza",4.0,48,"Rather Love-LY, Rest.!! Great Employee's, Wonderful, "" Fire"" ambiance, & Fantastic- Oven- Provided, Sandwiche's!! -😊! The Karakash. Established Family!",Medium
648,Just a Taste,116 N Aurora St,NY,Ithaca,14850-4302," American, Spanish, Wine Bar",4.5,533,"On my first visit, I went on a Friday evening at opening. There was line outside, which I thought was promising, considering the reviews.
The room was filled immediately but the wait staff was fairly prompt. Our orders came out in a reasonable amount of...More",Medium
649,Waffles Caffe,1510 N 1st St,WA,Yakima,98901-1727," American, Vegetarian Friendly, Gluten Free Options",4.5,74,Waffles Cafe at Meadowbrook Mall is a family friendly economical great place to eat.  Great food...sensitive to diet restrictions and a favorite on our list of restaurants.,Cheap
650,MezzaNotte,2026 Western Ave,NY,Albany,12203-5096," Italian, Vegan Options, Gluten Free Options",4.5,206,"Excellent-salad appetizer, and taupenade with our bread, halibut special and cognacs!  We will return. Buonasera!",Medium
651,JP's Taproom & Grill,Kent-Kangley Road,WA,Kent,WA," American, Bar, Pub",4.0,32,My fiance and often hit JP's after work. They have great service and terrific food. We ended up going in on Saturday as a break from the yardwork mid day. Great service and great cold beer,Medium
652,Antonio's Trattoria,2370 Belmont Ave,NY,Bronx,10458-8208," Italian, Vegetarian Friendly, Vegan Options",4.5,228,"Waiter had no personality at all - bus boy was more involved in meal.
Hot antipasto appetizer was  not well presented or prepared as all the different items seemed to mix with each other and share the same sauces. 
Dinner- Veal Parmigiana was overcooked and...More",Medium
653,Carlucci's Grill,1633 Big Oak Rd,PA,Yardley,19067-6418," Italian, Vegetarian Friendly, Vegan Options",4.5,242,Excellent byob italian.i had veal and shrimp marsala over papadell.my brother had crabcake with grilled vegetables and mashed potatoe. Salad and soup were excellent.service was great.Desert presentation and taste amazing.great place,Medium
654,The Thirsty Koala,3512 Ditmars Blvd,NY,Astoria,11105-2107," Australian, Vegetarian Friendly, Vegan Options",4.5,135,"WOW, what a great experience.  Authentic Australian drinks, food and culture here in Astoria, NY.  The atmosphere here is fun and very lively.  From the appetizers to the entrees everything was delicious .  My friends and I took the advice of the owner and staff...More",Medium
655,Ivar's Seafood and Chowder,1520 41st St,WA,Everett,98203-2357," Seafood, Fast Food, Soups",4.5,59,"I Thought I'd reviewed this location long ago as we've been coming here for a number of years.  Simply put they get fish and chips right every time.  The baby shrimp and onion rings are great as well.  The service is friendly and prompt, even...More",Cheap
656,Hattie's,45 Phila St,NY,Saratoga Springs,12866-3211, American,4.0,747,"Took friends into restaurant for pre chowderfest dinner. We all had fried chicken, Nashville chicken and catfish. 
There chicken has been rated best in ny state by food channel and after you try you will taste why. Awards all over the walls 
Small place nice...More",Medium
657,I Gemelli,268 Huyler St,NJ,South Hackensack,07606-1434," Italian, Vegetarian Friendly, Vegan Options",4.5,66,We had reservations for a table of four on New Years Eve.  We had the early seating of 5 pm.  They also had a later seating at 7:30 pm that night.  It was very crowded (as it usually is on Saturday evenings and holidays).  Three...More,Medium
658,Astoria Pizza & Pasta,4629 168th St SW,WA,Lynnwood,98037-8640," Italian, Pizza, Vegetarian Friendly",4.5,51,"Pizza day so we ended up at this well known local restaurant. You can order at the counter after you choose dinner, which makes it a little different than normally.

The have a sign with additional menu offers which have sharp prices. The 7"" Pizza...More",Cheap
659,Cast Iron Grill,620 19th St,TX,Lubbock,79401-5228," Grill, American, Vegan Options",4.5,561,First time to cast iron grill and I will be back brandy my waitress was nice and courteous. Thank you for the great service I will be visiting again. Thank you Brandy,Medium
660,Olive Burger Richardson,451 W Arapaho Rd,TX,Richardson,75080-4552, American,4.5,60,"LOVE this place!!
Tried it for the first time today.
Food was delicious, price was terrific, staff was friendly!
We will definitely be back!

The fries are to die for and my grilled chicken burger was the biggest I've ever had!
Shakes are great, too!",Cheap
661,Sages Restaurant,15916 NE 83rd St,WA,Redmond,98052-3873," Italian, International, Contemporary",4.5,165,Classical simple delicious dishes from the Moldovan rural areas. Food simple but tasty and amazing service,Medium
662,Lanie's Cafe,471 Albany Shaker Rd,NY,Albany,12211-1583," Italian, American, Bar",4.5,176,"While visiting Albany we came here for dinner. It was a long wait (Saturday night and we did not have reservations).  The restaurant was noisy but the food was very good.  As others mentioned, the portions are large.  We saw many people leaving with leftovers,...More",Medium
663,Aloy's Italian Restaurant,157 Garden St,NY,Poughkeepsie,12601-1933," Italian, Pizza, Vegetarian Friendly",4.5,153,Haven't been to Alloy's in years so wife and I and 5 of our friends decided to eat here. Food was absolutely delicious and portions were large. Service was out of this world. Prices were very reasonable. We will defiantly start going more often.,Medium
664,El Toro Mexican Restaurant,12115 Canyon Rd E,WA,Puyallup,98373-4459," Mexican, Vegetarian Friendly",4.0,68,"They have most of the traditional menu items plus some of their own item.  The sauce on their Chicken al Carbon is excellent.  Restaurant is large with a huge bar seating area.  Beer tap had only 6 different beers, drinks were mixed very well.",Medium
665,Texas Roadhouse,5722 San Bernardo Ave,TX,Laredo,78041-3010," American, Steakhouse",4.5,148,I stopped in here based on the high recommendations from the Trip Advisor apps. The food and service were very good. The herb roasted chicken was especially good and well priced during the day. The only downside of this place is it it’s extremely crowded...More,Medium
666,Torero's Mexican Restaurants,920 N 10th St,WA,Renton,98057-5595," Mexican, Southwestern, Vegetarian Friendly",4.0,149,Met my date here for a late lunch in the bar.  The waitress was extremely friendly and attentive.  I have a particular way that I like my burrito with whole beans and rice on the side.  The waitress was able to capture what I wanted...More,Medium
667,Matts' Rotisserie & Oyster Lounge,16551 NE 74th St,WA,Redmond,98052-7803," American, Bar, Seafood",4.0,317,We went with a group of friends for Happy Hour and were very pleasantly surprised.  There was an excellent selection of beverages and small plates at a reasonable price.,Medium
668,Powerhouse Restaurant Brewery,454 E Main,WA,Puyallup,98372-3258," American, Bar, Pub",4.0,151,"Stopped in for dinner and beer and had a great time.  The pizza was delicious and the fish and chips (I substituted the chips with onion rings which were made perfectly by the way.) was as well.  We enjoyed the atmosphere, but we have to...More",Medium
669,Nerai,55 E 54th St,NY,New York City,10022-4206," Seafood, Mediterranean, Greek",4.5,647,"If you're looking to get off of ""restaurant row"" and need an option for a pre show meal, I would recommend Nerai.  The space is very nice and roomy for a NY restaurant.  We had more then a foot in between tables.  The wait staff...More",Expensive
670,Lombardo's Pizza and Pasta,1203 Mamaroneck Ave,NY,White Plains,10605-4804," Italian, Pizza, Vegetarian Friendly",4.0,96,"Came here on the spur of the moment. We had the Marguerita pizza
and the calamari scarpiello which was the best we ever had
Comes with a little sausage and a hint of spice

Excellent service.",Medium
671,Juliana's Pizza,19 Old Fulton St,NY,Brooklyn,11201-1322," Pizza, Neapolitan, Campania",4.5,3095,"Went here for dinner after walking across the Brooklyn Bridge.  We thought the pizza was excellent.  We had to wait a bit for a table but it was worth it.  And once we ordered, the food came fast. My son got the spaghetti and meatballs...More",Medium
672,Amy Ruth's Home Style Southern Cuisine,113 W 116th St,NY,New York City,10026-2521," American, Vegetarian Friendly",4.0,895,Hands down the best fried chicken I have ever had! Come hungry - the portions are huge. Can’t wait to go back and have the chicken and waffles. My husband said it was great!,Medium
673,Palace Korean BBQ,15932 NE 8th St,WA,Bellevue,98008-3908," Barbecue, Asian, Korean",4.0,35,"The food was good and the service was also satisfactory. I had tried the Korean do your own BBQ first time in South Korea and I must say, this was pretty close to the authentic Korean BBQ experience.",Medium
674,Tacos Garcia,2200 E Amarillo Blvd,TX,Amarillo,79107-5542," Mexican, Southwestern, Vegetarian Friendly",4.0,156,"Most excellent.  Large choice of entrees, great value. Superb service and atmosphere. Endless chips and salsa.",Medium
675,Dinosaur Bar-B-Que,99 Court St,NY,Rochester,14604-1824," American, Bar, Barbecue",4.5,2306,"Saucy,delicious and just right spice Side note, i love the corn that comes with each meal. Fun place, a little loud. On street parking limited, but food worth it.",Medium
676,LongHorn Steakhouse,160 Route 17 North,NJ,Rochelle Park,07662-4004," American, Steakhouse",4.0,87,"My local place for a dinner. Good steak and service. What else do you need 👍
Usually we going with family to celebrate events or I can go solo sometimes",Medium
677,Texas,3609 Shire Blvd,TX,Richardson,75082-2245," American, Steakhouse, Gluten Free Options",4.5,306,"This is a good place, something for everyone. The menu is extremely varied, both selections and prices. The number of service people is almost over-the-top. Prices vary from $12.95 for a nice burger plate to about $50 for a large filet. Several fish dishes also,...More",Expensive
678,MOROSO Wood Fired Pizzeria,4700 Bosque Blvd,TX,Waco,76710-4661," Italian, Pizza, Vegetarian Friendly",4.5,158,Had the lobster ravioli which was very mediocre. You could not taste the stuffing inside. The pizza was good. Brusetta Average.,Medium
679,De Novo European Pub,275 Bellevue Ave,NJ,Montclair,07043-1300," American, Bar, European",4.5,205,We came to De Nova for a business meeting and found the restaurant to be warm cozy and casual.    After  looking over the menu  I was thrilled to see the pasta was available gluten free.  Past attempts at gluten free pasta resulted in tasteless and...More,Medium
680,Chuy's,4001 Bagpiper Way,TX,Arlington,76018-6052," Mexican, Southwestern",4.5,154,"This place stays busy because the food is so good. They have a variety of plates to choose from. The Tres Leches cake is to die for you just cant find another like it,",Medium
681,Thirsty Lion Gastropub & Grill,350 Las Colinas Blvd W,TX,Irving,75039-5469," Gastropub, Vegetarian Friendly, Gluten Free Options",4.0,73,"Thirsty Lion is located in Toyota Music Factory in Irving. The restaurant is new and well decorated. They serve American food: sandwiches, salads, and hamburgers. Thirsty Lion serves brunch on Saturdays and Sundays. Food is good, but nothing special.",Medium
682,zero otto nove,2357 Arthur Ave,NY,Bronx,10458-8103," Italian, Pizza, Vegetarian Friendly",4.5,426,"A fund and exciting menu...staff is helpful and  accommodating  and dining there is really an experience like
being in  Tuscany...especially if it is someone's birthday!",Medium
683,Franklin Barbecue,900 E 11th St,TX,Austin,78702-1905," American, Barbecue, Grill",4.5,1657,"I was in Austin for a business meeting with 8 other co-workers.  Someone found a website to pre-order Franklin BBQ, which we did 6 weeks prior to our trip.

Every other BBQ I've had was a pretender, a sham, a fake.  Franklin is the real...More",Medium
684,Joe & Pat Pizzeria,1758 Victory Blvd,NY,Staten Island,10314-3510," Italian, Pizza, Vegetarian Friendly",4.5,107,the pizza here is one of Staten Islands best.  They make a thin crust and it's super nice. This is a delicious meal paired with one of their salads.....love the fennel one.  Try an add on to the pizza and save your appetite because you...More,Medium
685,Breakers Korean Grill & Barbecue,8320 State Highway 121,TX,Frisco,75034-8554," Barbecue, Asian, Korean",5.0,104,We loved our dinner here to celebrate a birthday. Our teenage kids loved the interactive nature and being able to cook their own meat.,Medium
686,WildFin American Grill,777 Waterfront Way,WA,Vancouver,98660-3533," American, Bar, Seafood",4.0,152,We had my mother's 80th Birthday party at Wildfin with 30 of her closest friends and family. Everything was perfect. The food was excellent. We ordered appetizers and wine while our party had time to mingle and then also had a sit down dinner. The...More,Medium
687,"Little Sheep Mongolian Hot Pot, Edison",1737 State Route 27,NJ,Edison,08817-3471," Chinese, Asian, Soups",4.0,70,"Excellent flavors. Always look at the distribution of reviews. Even the best restaurants will have a few 1-star reviews. In this case, if you don't like the food, it usually means your tastebuds are weak, or you picked the wrong meat.",Medium
688,Fig Tree Restaurant,515 Villita St,TX,San Antonio,78205," International, Vegetarian Friendly, Gluten Free Options",4.5,336,"This was our first dinner in San Antonio and it certainly set the bar very high for all others. The setting is unique and romantic. We sat outside at a 2 top and enjoyed the elevated view down to the Riverwalk. Service was professional, but...More",Expensive
689,Boudro's,421 E Commerce St,TX,San Antonio,78205-2814," American, Southwestern, Vegetarian Friendly",4.5,4620,"Had been here roughly 10 years ago on vacation and it was top notch.  Visited again recently and it seems the place has slipped in quality.  There was an issue at our table and the server addressed it to the best of their ability.  However,...More",Medium
690,Bogie's Hoagies,Lafayette Avenue,NJ,Hawthorne,NJ," American, Vegetarian Friendly",4.5,66,"If you’re tired of the hero sandwiches prepared like the assembly line in a manufacturing plant - try this place - freshly prepared, great quality, and attention to detail make this “Hoagie Shop” a special kind of place.  The last time I went to one...More",Cheap
691,Odd Duck,1201 S Lamar Blvd,TX,Austin,78704-2368," American, Vegetarian Friendly, Vegan Options",4.5,536,"The odd thing about Odd Duck is that duck is not on the menu. Besides that, the food is delicious.

Tuna ceviche is not your typical ceviche. It has a hint of sweetness and not sour at all. It is fun to eat and will...More",Medium
692,Knife & Fork Inn,3600 Atlantic Ave,NJ,Atlantic City,08401-6198," American, Seafood, Gluten Free Options",4.5,748,"As long as I’ve been in the area, I’ve never been to one of Atlantic City’s most historic restaurant. Took my wife there for Valentines Day.

For appetizers we had the jumbo lump crab cocktail and lobster spring roll.  The lumps in the crabmeat were...More",Expensive
693,Turning Point of Brick,505 Route 70,NJ,Brick,08723-4043," American, Vegetarian Friendly, Vegan Options",4.5,193,"We were finally able to get in to Turning Point. They usually have a very long wait, so we don’t stay. This time we made it in! The menu had excellent options and a fresh juice bar menu too! Our food came out pretty quickly...More",Medium
694,Capistrano's,4650 W Airport Fwy,TX,Irving,75062-5825," American, Vegetarian Friendly, Gluten Free Options",4.5,242,"I have been coming to this hotel and restaurant for 4+ years. I would recommend this place to stay yet in their food and service is wonderful. Jessica, Mo, Brandie, Victoria, Rosa Donny and Kareem.",Medium
695,Azul Restaurant and Lounge,15118 Main St,WA,Mill Creek,98012-1653," Mexican, Southwestern, Bar",4.5,192,Friend and I has a last minute thought about going out to dinner and we decided to go to Azul. We had Salmon Caesar Salad with dressing on the side with avocado.  It was delish! Perfect for late night dinner. Not too heavy for the...More,Medium
696,The Woolworth,1520 Elm St,TX,Dallas,75201-3509," American, Bar, Fusion",4.5,254,I had the lobster grilled cheese for lunch and it was fantastic! I loved the atmosphere. The ordering line went at a descent speed and the food came out pretty fast.,Medium
