,Name,Street_Address,State,City,Zip_Code,Type,Reviews,No_of_Reviews,Comments,Price_Range
1238,Sang Kee Noodle Cafe,1601 Kings Hwy N,NJ,Cherry Hill,08034-2318," Chinese, Asian, Vegetarian Friendly",4.5,69,What a wonderful place to have a great meal. Always busy and tables are filled with people eating delicious food.  We have been going here since they opened and are always happy with the service and the food.  Waste no time deciding where to go...More,Medium
1239,Ruth's Chris Steak House,2 Village Boulevard,NJ,Princeton,08540," American, Steakhouse, Vegetarian Friendly",4.0,367,"Dear Jose Morales,

After recently moving to the area we heard great things about your restaurant. Unfortunately, we didn’t make a reservation for New Years Eve. My wife and I arrived to RC at 6:30PM and were fortunate enough to receive lounge seating past the...More",Expensive
1240,La Riviera Trattoria,421 Piaget Ave,NJ,Clifton,07011-3002," Italian, Vegetarian Friendly, Vegan Options",4.5,114,Celiac and gluten free friendly restaurant. They have a separate gluten free kitchen. Very knowledgeable and aware of food allergies. Gluten free menu available. The food is excellent.,Medium
1241,Perry St,176 Perry St,NY,New York City,10014-2384," Contemporary, Vegetarian Friendly, Gluten Free Options",4.5,367,"Upscale restaurant in an unexpected location. Great value with the restaurant week menu. Everything was very tasty, maybe just a bit too salty. We had the tuna tartar to start and the duck as a main. We also tried the braised lamb shank, which was...More",Expensive
1242,Stockade Inn,1 N Church St,NY,Schenectady,12305-1698," American, Bar, Pub",4.0,82,"This hotel may not be for everyone, but it should be!  The building itself is situated on a corner in a peaceful section of the city. It's far enough from the hustle and bustle to be quiet and relaxing, and yet it is within walking...More",Medium
1243,Greenhouse Cafe,605 Long Beach Blvd,NJ,Ship Bottom,08008-4640," American, International, Vegetarian Friendly",4.0,232,"It seems like the place is getting tired 
Ordered poached eggs and corned beef hash the hash was very burnt and the potatoes were soft my wife's omelet was thin but ok service from Pat was good",Medium
1244,Citron European Bistro,10716 A St S,WA,Tacoma,98444-6003," French, European, German",5.0,58,I hate to tell anyone about this great place for fear I will no longer be able to get a last mnute table!  Authentic wiener schnitzel and other french dishes.  It's a husband and wife team.  The husband cooks some amazing dishes.  Good wine to...More,Medium
1245,Xochimilco Mexican Restaurant,2304 W Nob Hill Blvd,WA,Yakima,98902-5237," Mexican, Latin, Spanish",4.0,57,"The service was good, but the food was cold and so full of onions  that it wasn’t edible and I’m sure the beans were out of a can. I was disappointed, I had been wanting to go there for so long but once was enough...More",Medium
1246,B&J's Pizza,6335 S Padre Island Dr,TX,Corpus Christi,78412-4013," Pizza, Vegetarian Friendly",4.5,103,"Outstanding Pizza and Wings in a Great Beer Bar! The pizza had a thin crust that had a great yeasty flavor and was cooked really hot, with a great texture to the crust. The toppings were plentiful and high quality. We tried sausage - bacon...More",Medium
1247,Ambition Bistro,154 Jay St,NY,Schenectady,12305-1906," American, Cafe, Vegetarian Friendly",4.5,133,"This little cafe was a great surprise. The food was excellent, the atmosphere was unique and casual and the staff was chill and friendly!",Medium
1248,Jaspers Richardson,1251 State St,TX,Richardson,75082-2031," American, Steakhouse, Gluten Free Options",4.0,79,"We went here for dinner on a Saturday night and had an absolutely top-notch experience from start to finish. The interior is modern, upscale, very clean and sleek. 

Our server Micah was excellent. He was personable and his descriptions of the food were similar to...More",Expensive
1249,Del Frisco's Grille,154 East 3rd St,TX,Fort Worth,76102," American, Bar, Asian",4.0,376,"The restaurant was nice. Great location in Sundance Square! Festive for the holidays. The service was fast and we did not feel rushed to leave. The impossible burger was fabulous! If you’re vegan, ask for specifics on the add-on’s.",Medium
1250,Taqueria Ultimo Taco,938 N Expressway,TX,Brownsville,78521-1404," Mexican, Latin, Spanish",4.5,33,"A popular joint in the area. I heard about this place as a great recommendation from several people in South Padre Island, TX. So my wife and I had to check it out. The place is not very big, but the first thing I noticed...More",Cheap
1251,Afrah Mediterranean Restaurant and Pastries,318 E Main St,TX,Richardson,75081-6045," Lebanese, Mediterranean, Middle Eastern",4.0,211,"I went mid-week and it was a nice overall experience.  Most of the chicken could have used a little more time in the oven as it was a bit firm and a piece or two was a little dry.  The other things, in general, were...More",Medium
1252,Ice House on the Hudson,1 Main St,NY,Poughkeepsie,12601-2907," American, Bar",3.5,363,"The food here is always good. That being said, it's just good. But you're going there for the ambiance. Sitting right out on the Hudson River is stunning. Will continue to go back for this reason!",Medium
1253,Perry's Steakhouse & Grille- San Antonio,15900 La Cantera Pkwy Ste 22200,TX,San Antonio,78256-2466," American, Steakhouse, Gluten Free Options",4.5,360,My wife and I enjoyed dinner here and it was wonderful. I ordered the pork chop not knowing it was a signature dish.  It was truly spectacular in taste and size!  I worked on the leftover for a couple of days.  Perry's is not cheap...More,Expensive
1254,Taj Palace,2710 W Nob Hill Blvd,WA,Yakima,98902-5107," Indian, Vegetarian Friendly, Vegan Options",4.5,136,"dinner was very good ,came back another time to try lunch buffet it was very good worth the trip for sure all you can eat good selection great chi tea .",Medium
1255,Aviation Grill,1 Hotel Rd,NJ,Newark,07114-3513," American, Bar, Gluten Free Options",4.0,147,Our food came out hot and delicious. The sandwiches were flavorful and delicious. The fries were also hot and delicious. Service was quick and friendly.,Medium
1256,LuNello's Resturant,182 Stevens Ave,NJ,Cedar Grove,07009-1149," Italian, Vegetarian Friendly, Vegan Options",4.5,114,"My sisters and their husbands and I went here for my Mom’s 88th birthday. Wonderful restaurant. The food and service were spectacular. The portions were surprisingly large. But of course you pay for what you get. My brother-in-law picked up the tab, which had to...More",Expensive
1257,Libby's Lunch,98 McBride Ave,NJ,Paterson,07501-2660," American, Fast Food, Diner",4.5,102,"Excellent service. Good example of the famous NJ Texas Wiener.  I get there every couple of years. My question is--Did they change their brand of hot dog?  Maybe it's me, but they seem different.",Cheap
1258,HuHot Mongolian Grill,11703 E Sprague Ave,WA,Spokane Valley,99206-6128," Asian, Mongolian, Vegetarian Friendly",4.0,108,Great place to go with family or friends. You pick what you want with the sauces you want and they cook it up right there while you wait. The staff is great and the food is always fresh and wonderful. It is all you can...More,Medium
1259,San Carlo Osteria Piemonte,90 Thompson St,NY,New York City,10012-3744," Italian, Mediterranean, Vegetarian Friendly",4.5,695,Was greatly pleased by this discovery in Soho. The staff is great and the food more than incredible plus a good selection of wine makes this a pleasant place to eat.,Medium
1260,The Bine Beer & Food,10127 Main St Suite A,WA,Bothell,98011-3425," American, Bar, Pub",4.5,14,"We had a pretty amazing experience here. It would be a 5 star for me if they had more tables available (to be fair, it is because it was so busy aka popular). They had a wonderful gluten free bun so I was able to...More",Medium
1261,Silver Fox Steakhouse Frisco,1303 Legacy Dr,TX,Frisco,75034-6018," American, Steakhouse, Vegetarian Friendly",4.5,205,This place was once our go to. Has changed quite a bit. The manager (John) was one of the rudest people we’ve ever encountered at a restaurant. So much so that we won’t go back. Food is good but not great. Has gone downhill. Too...More,Expensive
1262,Old Town Cafe,316 W Holly St,WA,Bellingham,98225-4314," American, Cafe, Healthy",4.0,140,All four of us had delicious breakfasts. Great mushroom tahini biscuits and gravy. Wonderful strawberry freezer jam at the table. I had the London Fog to drink. Yum!,Medium
1263,Butcher Bar,3710 30th Ave,NY,Astoria,11103-4331," American, Bar, Barbecue",4.5,314,Tried this place in on a groupon and this place blew me away. The food was amazing and the service was 5 stars. I can't wait to go back.,Medium
1264,Pac Island Grill,2012 S 320th St,WA,Federal Way,98003-5454," Polynesian, Hawaiian, Barbecue",4.5,64,First time I came here I was staying at a nearby hotel checking google maps for places to eat.  I immediately got excited seeing a Hawaiian BBQ that was not a chain here in Federal Way.  That atmosphere is fun with live music some nights....More,Medium
1265,Jines Restaurant,658 Park Ave,NY,Rochester,14607-2943," American, Greek, Vegetarian Friendly",4.0,501,We have heard high reviews about this restaurant and finally had the opportunity to get to that side of time only to be disappointed. My Spanakopita had no taste and from the other reviews I saw others received pita bread. I did not .  I...More,Medium
1266,Stanley & Seafort's Steak Chop & Fishhouse,115 E 34th St,WA,Tacoma,98404-1502," American, Steakhouse, Seafood",4.0,530,Meatloaf was outstanding. Prime rib was perfect. Wait staff was attentive. Clean. Good views. Was charged a weird tax. Pricey overall.,Expensive
1267,Cannelle Patisserie,7559 31st Ave,NY,Flushing,11370-1811," Bakeries, Cafe, French",4.5,86,French pastry the best place. Delicious breakfast and good Service free  parking.I will  recommend Very clean pastry,Medium
1268,Terracotta Red Bistro,2820 Hewitt Ave,WA,Everett,98201-3820," Asian, Vegetarian Friendly, Vegan Options",4.5,297,"The only reason this restaurant is getting three stars is because of great service.  I ordered Heaven & Earth, a combo of pork, beef, shrimp and maybe chicken. Can't remember now.  All of the meats and shellfish were overdone.  Chewy and tough with very little...More",Medium
1269,Mod Pizza,2902 164th St SW,WA,Lynnwood,98087-3201," Pizza, Vegetarian Friendly",4.5,54,"This is the 4th Mod Pizza we have eaten in and they have all been delicious,  Restaurant was clean, staff was friendly,, pizza was good and they even have a gluten free crust for my husband.  Would eat here again.",Cheap
1270,Ice Harbor Brewing Company,206 N Benton St,WA,Kennewick,99336-3608," American, Bar, Pub",4.0,86,"It's a brew pub,  located in an old railway building.  The IPA IS GREAT! the Kolsch is authentic and smooth... Try the potato rounds appetizer, and the sandwiches are a really good value. Did I say great beer? And a fantastic atmosphere.  Sometimes you even...More",Medium
1271,Saigon Kitchen,526 W State St,NY,Ithaca,14850-5222," Asian, Vietnamese, Vegetarian Friendly",4.5,331,"We were passing through Ithaca in route to Corning.  Stopped by in this place based on reviews.  Delicious food, friendly staff who were helpful and the food is out of this world.  Absolutely delicious.  Look forward to going there again if I'm ever in this...More",Medium
1272,SteamPlant,159 S Lincoln St,WA,Spokane,99201-4420," American, Bar, Brew Pub",4.0,466,"Stopped in with a group of friends before heading back to Montana. The food was delicious, good bar, all in a unique setting. This was originally a hugh steam plant in downtown Spokane converted into a restaurant with a few business offices incorporated    
among the...More",Medium
1273,Seasons 52,7300 Lone Star Dr,TX,Plano,75024-5647," American, International, Contemporary",4.5,811,"This is a solid, consistently good food. Were there for a business dinner in late January and found a wide variety of options, ranging from vegetarian, pork tenderloin, filet mignon, ricotta stuffed chicken, etc. We sampled several flat breads to start - all good. Dessert...More",Expensive
1274,Budd Bay Cafe,525 Columbia St NW,WA,Olympia,98501-8230," American, Bar, Seafood",4.0,743,"My favorite is the crab louie and always enjoy their clam chowder soup to start.  Oh, they add a dash of Sherry if you would like and now I always ask for it.   The last time I was in I saw a terrific looking steak...More",Medium
1275,Hahm Ji Bach,4011 149th Pl,NY,Flushing,11354-4942," Barbecue, Asian, Korean",4.5,53,"We actually came here after we couldn't get in to two other Korean BBQ places on a Sat nite with no reservations.  I thought we lucked out since the food was very good and service was fine too. When ordering beef to cook, go with...More",Medium
1276,Chama Gaucha Brazilian Steakhouse,5865 Westheimer Rd,TX,Houston,77057-5616," Steakhouse, Brazilian, South American",4.5,908,My carnivorous kids like their birthdays celebrated in this place. Plus they get a free dessert with a candle to blow.,Expensive
1277,The Mouzon House,1 York St,NY,Saratoga Springs,12866-2309," French, Cajun & Creole, American",4.5,356,Wonderful dinner but expensive. $25 mac & cheese! We would visit more often but bringing friends can be difficult due to prices. Great food!,Expensive
1278,The Vermillion,115 Paredes Line Rd,TX,Brownsville,78521-2243," Mexican, American, Southwestern",4.0,289,"Anything you order is wonderful: it’s homey and delicious! If no table is available, it’s worth the wait. Best local restaurant in town!",Medium
1279,City Tavern,1109 Elizabeth Ave,NJ,Elizabeth,07201-2497," American, Bar, Pub",4.0,49,"Had a reservation for 15 coworkers after a long day of training meetings.  The team at the City Tavern made sure our drinks were always full, and were absolutely amazing explaining the menu and taking care of us.  Everyone in our group was extremely pleased...More",Medium
1280,Mill House Brewing Company,289 Mill St,NY,Poughkeepsie,12601-3111," American, Bar, Pub",4.5,694,Haven’t been here in a long time. Glad I stopped. Visually stunning environment. Creative and inventive cuisine. Homemade sausage and house made brews. Fresh made rigatoni with sausage. Superb Bacon and ham club sandwiches with string fries. The Chick pea appetizer was delicious!! Very attentive...More,Medium
1281,The Big Fish Grill,10426 Northup Way,WA,Kirkland,98033-7912," American, Seafood, Bar",4.0,112,"My husband and I were staying close and were told by our hotel that it was good, decided to give it a try. We had a delicious grilled artichoke, sourdough bread and we both loved our meals!  Would highly recommend!",Medium
1282,Piccola Cucina,184 Prince St,NY,New York City,10012-2979," Italian, European, Sicilian",4.5,1045,"A very little restaurant but they provide amazing food and they are the nicest people you will meet. Loved it, would happily come again when in NY!",Medium
1283,Palenque Grill Loop 20,7220 Bob Bullock Loop,TX,Laredo,78041-2058," Steakhouse, Seafood, Mexican",4.5,359,This is a very high end clean restaurant with really great food. I had the Fajitas de Pollo and it was unbelievable ! You will get the best bang for the buck here High end facilities with a cheap price. Highly recommend.,Medium
1284,George's Place,108 Kirkland Ave,WA,Kirkland,98033-6504," American, Greek, Vegetarian Friendly",4.0,152,"One of those iconic places that never goes out of style. They sell quality food in spotless surroundings and the service is good, but not great.  We've only tried the breakfast menu and the omelette's are especially good.  Try the locally-grown, sliced tomatoes instead of...More",Medium
1285,Terracotta Red Bistro,2820 Hewitt Ave,WA,Everett,98201-3820," Asian, Vegetarian Friendly, Vegan Options",4.5,297,"The only reason this restaurant is getting three stars is because of great service.  I ordered Heaven & Earth, a combo of pork, beef, shrimp and maybe chicken. Can't remember now.  All of the meats and shellfish were overdone.  Chewy and tough with very little...More",Medium
1286,Kubel's,7th Street and Bayview Avenue,NJ,Barnegat Light,08006," American, Bar, Seafood",4.0,238,Kubel’s is definitely one of the best restaurants on the Long Beach Island. The location is very nice and the outside seating gives you a great view of the bay. The atmosphere inside is very comfortable and the food is excellent. The restaurant doesn’t require...More,Medium
1287,Trattoria Romana,1476 Hylan Blvd,NY,Staten Island,10305-1923," Italian, Vegetarian Friendly, Gluten Free Options",4.5,259,We drove over from Pennsylvania to by Christmas decorations at the Garden Center down the street and were steered to this restaurant by the gentleman at the Garden Center. He did us a great favor as we had a wonderful lunch with excellent food in...More,Medium
1288,Frankie's Mexican Cuisine,2701 Custer Pkwy,TX,Richardson,75080-1667," Mexican, Southwestern, Vegetarian Friendly",4.5,304,We have been to Frankie's restaurant many times over the years and have taken out-of-town guests here as well. The result   the same - we love it and so do our guests. Frankie's has an extensive menu and some items you do not always see...More,Medium
1289,Rosalita's Roadside Cantina,1048 Cedar Bridge Ave,NJ,Brick,08723-4000," Mexican, Southwestern",4.0,26,"We don't eat at many chain restaurants, but found ourselves in this vicinity and hungry, so decided to try Rosie's.
Casual ambiance with bar as you enter and tables and booths in the back.
Jose was our attentive server.
What's up with those crazy prices?...More",Medium
1290,Aspen Creek Grill,4300 W Airport Fwy,TX,Irving,75062-5819," American, Southwestern, Bar",4.5,630,"Went for dinner, traveling for work. Sat at bar. Good service and friendly crowd. Plenty of TV's, good selection of beers. Food okay.
Easy to get in and out.",Medium
1291,IKEA,7171 Ikea Dr,TX,Frisco,75034-8591," Scandinavian, American, Swedish",4.0,106,Love the Swedish meatballs and for such an amazing price. You can't beat it. Enjoyed the quick meal. Only problem is you might get lost in all the furniture!,Cheap
1292,Prep's Pizzeria,1004 Boardwalk,NJ,Ocean City,08226-3335," Pizza, Vegetarian Friendly, Vegan Options",4.5,121,This is our go-to pizza place in Ocean City. Simple. Good. Gets a bit busy at times but the lines move quick!,Cheap
1293,Saltgrass Steak House,1051 West Interstate 20,TX,Arlington,76015," American, Steakhouse, Vegetarian Friendly",4.5,963,"Saltgrass Steakhouse is our go to restaurant for lunch or dinner. Several convenient locations,
Prompt friendly service, wonderful food and great cook to order steaks!! If you have room after your meal the cheesecake is delicious 😋 I usually split a piece with someone! So...More",Medium
1294,Martha's Country Bakery,3621 Ditmars Blvd,NY,Astoria,11105-1918," Bakeries, Cafe",4.5,127,"Family oriented. Fresh, flavorful and delicious desserts, especially the berry napoleon and the chocolate layer cake. A must go to in Astoria.",Medium
1295,Lola's Catering and Cafe,131 Washington St,NY,Poughkeepsie,12601-1813," American, Cafe, Asian",4.5,201,"Very good, homemade food. Even though you order at the counter, the staff was friendly and accommodating. There is a good assortment of sandwiches, salads, and burgers. A great option for lunch or takeout.",Medium
1296,Uchi,801 S Lamar Blvd,TX,Austin,78704-1509," Japanese, Seafood, Sushi",4.5,1331,"My husband and I travel often and have eaten at many fine restaurants. Uchi has to be one of the very best we have ever gone too. I never know the best items to choose at a Japanese  restaurant. Our server, Lauren, quizzed us about...More",Expensive
1297,Bonefish Grill,22616 Bothell Everett Hwy,WA,Bothell,98021-8420," American, Bar, Seafood",4.0,264,"A great Valentines Day Meal!!. Even with sold out, standing room only while patrons waiting to be seated, the hostess staff  met each customer with a cordial, heartfelt welcome. Kitchen  responded with well prepared, quality meals with minimum delay and meals were excexptional, properly serverd....More",Medium
1298,Mama Stortini's,3207 E Main,WA,Puyallup,98372-3112," Italian, Vegetarian Friendly, Gluten Free Options",4.0,223,"Large menu for lunch. Pasta. Pizza and salads are excellent.  The chicken  marsala is wonderful...savory, juicy pieces of chicken served on top of pasta and parmesan grated over the top. My friend had a small caesar salad with fried calamari (for an additional price). There...More",Medium
1299,Totem Family Dining,4410 Rucker Ave,WA,Everett,98203-2301," American, Diner",4.5,143,Excellent breakfast! Excellent service! Excellent food!  The vegetable omelette was huge... who makes omelettes with 4 eggs. Hash browns and sourdough toast rounded out the platter. I couldn’t eat it all.,Medium
1300,Francesco's Restaurant,568 McBride Ave,NJ,Woodland Park,07424-2850, Italian,4.0,52,Sad to say that the brazino was deep fried and bland and the the Gnocchi with sauce was not a winner..Our overall experience was not good..😡,Medium
1301,Youngblood's Cafe,620 SW 16th Ave,TX,Amarillo,79101-4000," American, Cafe, Grill",4.5,128,Why go to a chain restaurant when their are so many of these wonderful family diners that encapsulate the local flavor of the town you are in. Youngblood's Cafe is Texas through and through. This is a local hangout with stories from the surrounding ranches...More,Medium
1302,Eddie V's Prime Seafood,3100 W 7th St,TX,Fort Worth,76107-2795," American, Seafood, Gluten Free Options",4.5,376,Great service from start to finish.  Everyone was very accommodating. Prices are inline with the quality of food and service you receive.,Expensive
1303,Nanking  rockaway,13407 Rockaway Blvd,NY,South Ozone Park,11420-3020," Indian, Asian, Chinese",4.5,36,"We're just staying in a hotel near my for an early morning flight. So glad we decided to  leave the hotel restaurant behind and try this place! The neighborhood is a little sketchy but there was plenty of parking right in front! 

The food is...More",Medium
1304,Texas Roadhouse,124B Fm 1960 Rd,TX,Houston,77073-1806," American, Steakhouse",4.0,117,"Took friends out here for Texas Roadhouse is pretty consistent.  And as usual, this one was again simply terrific. Restaurant was clean.  Service was terrific.  Management passed by to check if everything was fine. And then, the steaks were perfect.  A very good dining experience.",Medium
1305,Applebee's,606 N Columbia Center Blvd,WA,Kennewick,99336-7712," American, Bar, Vegetarian Friendly",3.5,124,I was staying at the Super 8 next door.  Applebee's offered convenient reasonably priced good dinners each night,Medium
1306,Wendy's Country Cafe,1915 California St,WA,Everett,98201-3602," American, Cafe, Diner",4.5,36,"Looking for different places to go with my nephew .The wife and I were in downtown Everett , and decided to check it out ourselves. So glad we did. Nice and quaint, Omelets were very light and fluffy... A very good experience.",Cheap
1307,Pho Saigon Garden,25632 Pacific Hwy S,WA,Kent,98032-5556," Asian, Vietnamese, Soups",4.5,21,"Totally satisfied with food and owners, Paul. I had as I usually do, Ox-tail Pho. He always treats me so well as a regular customer.",Cheap
1308,Benjamin Steakhouse,610 W Hartsdale Ave,NY,White Plains,10607-1812," American, Steakhouse, Gluten Free Options",4.0,232,Had dinner with 4 friends in December. We received good service from our waiter however a few of us were not impressed with the cut or flavor of our meat. We had 2 bottles of wine with dinner and appetizers and our check was almost...More,Expensive
1309,Bohanan's Prime Steak and Seafood,219 E Houston St,TX,San Antonio,78205-1854," American, Steakhouse, Vegetarian Friendly",4.5,1732,We enjoyed this entire experience from start to finish! The service was amazing by Rich (and Garrettt)! Rich selected the perfect cocktails 🍸 for us! The Texas heirloom salad & shrimp 🍤 were amazing! My husband had the tortilla soup 🥣 along with steak &...More,Expensive
1310,Ora Di Pasta,1 W 59 Th Street,NY,New York City,10019," Italian, Mediterranean, Vegetarian Friendly",4.5,235,Decent pasta in a good area of NYC. Very cool restaurant area in the food hall of the Home Alone Plaza Hotel!,Medium
1311,Mi Pueblito Restaurant,3101 Pablo Kisel Blvd,TX,Brownsville,78526-4436," Mexican, Latin",4.0,83,"Our team enjoyed a hearty lunch in this nicely decorated restaurant.  Big warrior like statues, skeletons (a la day of the dead theme), paintings and Mexican decor surrounded us as we dined at a large wooden table.

Meat dishes dominated the menu and many of...More",Medium
1312,Texas de Brazil,1 Ridge Hill Blvd.,NY,Yonkers,10710," Steakhouse, Brazilian",4.0,237,"Went to celebrate a birthday. $10 for a half a glass of room Temperature wine was too much. Ordered bottled water. Water was poured n then we noticed a glass was dirty. We were given a clean glass, but, the full glass from the bottle...More",Expensive
1313,Katie Downs,3211 Ruston Way,WA,Tacoma,98402-5334," American, Bar, Pizza",4.0,222,I don't know how this place gets so many good reviews! When you order your beverage your credit card starts running a tab. When your meal is finished the waitress gives you  the bill on a handheld computer where you are asked for your tip...More,Medium
1314,Eddie Napoli's Italian Resturant,8822 Teel Pkwy,TX,Frisco,75034-4417," Italian, Pizza, Vegetarian Friendly",4.5,117,This was our second visit and we were hoping to make it a regular but we probably won’t be back. First we ordered the mussels as an appetizer. Three of the mussels came to the table unopened. What chef/cook sends unopened shellfish to the table....More,Medium
